NAME	GS<br> follow link to MSigDB	GS DETAILS	SIZE	ES	NES	NOM p-val	FDR q-val	FWER p-val	RANK AT MAX	LEADING EDGE	
PID_CD8_TCR_PATHWAY%MSIGDB_C2%PID_CD8_TCR_PATHWAY	PID_CD8_TCR_PATHWAY%MSIGDB_C2%PID_CD8_TCR_PATHWAY		32	0.36619428	1.068677	0.3529412	0.69074136	1.0	2804	tags=47%, list=22%, signal=60%	
CELLULAR RESPONSE TO NUTRIENT LEVELS%GOBP%GO:0031669	CELLULAR RESPONSE TO NUTRIENT LEVELS%GOBP%GO:0031669		157	0.2843019	1.0686516	0.3116883	0.69038963	1.0	3154	tags=29%, list=25%, signal=38%	
SEPARATION OF SISTER CHROMATIDS%REACTOME DATABASE ID RELEASE 75%2467813	SEPARATION OF SISTER CHROMATIDS%REACTOME DATABASE ID RELEASE 75%2467813		143	0.2855593	1.0682716	0.33333334	0.6911528	1.0	3370	tags=32%, list=26%, signal=43%	
NEUTROPHIL MIGRATION%GOBP%GO:1990266	NEUTROPHIL MIGRATION%GOBP%GO:1990266		28	0.362314	1.06802	0.3653846	0.69152796	1.0	4414	tags=50%, list=34%, signal=76%	
SIGNAL RELEASE FROM SYNAPSE%GOBP%GO:0099643	SIGNAL RELEASE FROM SYNAPSE%GOBP%GO:0099643		33	0.37488568	1.0677468	0.369863	0.69178206	1.0	454	tags=12%, list=4%, signal=13%	
BLOOD COAGULATION%GOBP%GO:0007596	BLOOD COAGULATION%GOBP%GO:0007596		158	0.2856461	1.0672324	0.3764706	0.6929695	1.0	1234	tags=16%, list=10%, signal=17%	
CELLULAR POLYSACCHARIDE METABOLIC PROCESS%GOBP%GO:0044264	CELLULAR POLYSACCHARIDE METABOLIC PROCESS%GOBP%GO:0044264		36	0.36954516	1.0671606	0.390625	0.69281363	1.0	1744	tags=25%, list=14%, signal=29%	
REGULATION OF ALCOHOL BIOSYNTHETIC PROCESS%GOBP%GO:1902930	REGULATION OF ALCOHOL BIOSYNTHETIC PROCESS%GOBP%GO:1902930		28	0.40642655	1.0670873	0.36507937	0.6926813	1.0	1057	tags=18%, list=8%, signal=19%	
HALLMARK_CHOLESTEROL_HOMEOSTASIS%MSIGDB_C2%HALLMARK_CHOLESTEROL_HOMEOSTASIS	HALLMARK_CHOLESTEROL_HOMEOSTASIS%MSIGDB_C2%HALLMARK_CHOLESTEROL_HOMEOSTASIS		51	0.35034823	1.0666895	0.36231884	0.6934647	1.0	1635	tags=20%, list=13%, signal=22%	
TRANS-SULFURATION AND ONE CARBON METABOLISM%WIKIPATHWAYS_20210210%WP2525%HOMO SAPIENS	TRANS-SULFURATION AND ONE CARBON METABOLISM%WIKIPATHWAYS_20210210%WP2525%HOMO SAPIENS		17	0.4342318	1.0664388	0.36666667	0.69379693	1.0	244	tags=12%, list=2%, signal=12%	
POSITIVE REGULATION OF STAT CASCADE%GOBP%GO:1904894	POSITIVE REGULATION OF STAT CASCADE%GOBP%GO:1904894		38	0.37314892	1.0663532	0.3859649	0.6936354	1.0	3779	tags=42%, list=29%, signal=59%	
TRIGLYCERIDE METABOLIC PROCESS%GOBP%GO:0006641	TRIGLYCERIDE METABOLIC PROCESS%GOBP%GO:0006641		20	0.41708666	1.0662745	0.3768116	0.69348526	1.0	1640	tags=25%, list=13%, signal=29%	
CALNEXIN CALRETICULIN CYCLE%REACTOME%R-HSA-901042.2	CALNEXIN CALRETICULIN CYCLE%REACTOME%R-HSA-901042.2		24	0.39318982	1.0662086	0.41791046	0.69327796	1.0	1700	tags=29%, list=13%, signal=34%	
RIBONUCLEOTIDE BIOSYNTHETIC PROCESS%GOBP%GO:0009260	RIBONUCLEOTIDE BIOSYNTHETIC PROCESS%GOBP%GO:0009260		99	0.3034175	1.0661004	0.31578946	0.6931566	1.0	2139	tags=20%, list=17%, signal=24%	
NEGATIVE REGULATION OF NEURON DEATH%GOBP%GO:1901215	NEGATIVE REGULATION OF NEURON DEATH%GOBP%GO:1901215		74	0.31891942	1.066069	0.24324325	0.6928697	1.0	2976	tags=31%, list=23%, signal=40%	
CENTROSOME CYCLE%GOBP%GO:0007098	CENTROSOME CYCLE%GOBP%GO:0007098		70	0.31530666	1.0659999	0.33333334	0.6927091	1.0	921	tags=14%, list=7%, signal=15%	
REGULATION OF MYOTUBE DIFFERENTIATION%GOBP%GO:0010830	REGULATION OF MYOTUBE DIFFERENTIATION%GOBP%GO:0010830		25	0.38064688	1.0656829	0.37313432	0.69328696	1.0	1373	tags=24%, list=11%, signal=27%	
CELL CYCLE G1/S PHASE TRANSITION%GOBP%GO:0044843	CELL CYCLE G1/S PHASE TRANSITION%GOBP%GO:0044843		71	0.32431516	1.0655986	0.34146342	0.693161	1.0	2313	tags=21%, list=18%, signal=26%	
REGULATION OF LIPID LOCALIZATION%GOBP%GO:1905952	REGULATION OF LIPID LOCALIZATION%GOBP%GO:1905952		76	0.31622618	1.06541	0.3625	0.6932581	1.0	2208	tags=26%, list=17%, signal=32%	
ERBB2 SIGNALING PATHWAY%GOBP%GO:0038128	ERBB2 SIGNALING PATHWAY%GOBP%GO:0038128		26	0.3918064	1.0654005	0.39655173	0.6928746	1.0	2026	tags=27%, list=16%, signal=32%	
PLATELET AGGREGATION (PLUG FORMATION)%REACTOME DATABASE ID RELEASE 75%76009	PLATELET AGGREGATION (PLUG FORMATION)%REACTOME DATABASE ID RELEASE 75%76009		20	0.43977535	1.0652624	0.42372882	0.69281733	1.0	2679	tags=40%, list=21%, signal=50%	
TRICARBOXYLIC ACID METABOLIC PROCESS%GOBP%GO:0072350	TRICARBOXYLIC ACID METABOLIC PROCESS%GOBP%GO:0072350		31	0.36792752	1.064722	0.37179488	0.69396454	1.0	1367	tags=16%, list=11%, signal=18%	
NEUROTRANSMITTER RELEASE CYCLE%REACTOME%R-HSA-112310.5	NEUROTRANSMITTER RELEASE CYCLE%REACTOME%R-HSA-112310.5		21	0.40552875	1.0645664	0.38333333	0.6939178	1.0	911	tags=19%, list=7%, signal=20%	
PEPTIDE CROSS-LINKING%GOBP%GO:0018149	PEPTIDE CROSS-LINKING%GOBP%GO:0018149		15	0.4522604	1.0639704	0.359375	0.6951207	1.0	1428	tags=27%, list=11%, signal=30%	
AMYLOID FIBER FORMATION%REACTOME%R-HSA-977225.6	AMYLOID FIBER FORMATION%REACTOME%R-HSA-977225.6		36	0.36457875	1.0636691	0.4084507	0.69555235	1.0	978	tags=17%, list=8%, signal=18%	
ALCOHOL CATABOLIC PROCESS%GOBP%GO:0046164	ALCOHOL CATABOLIC PROCESS%GOBP%GO:0046164		24	0.39198714	1.063488	0.36231884	0.6957515	1.0	1863	tags=21%, list=14%, signal=24%	
REGULATION OF ENDOPLASMIC RETICULUM UNFOLDED PROTEIN RESPONSE%GOBP%GO:1900101	REGULATION OF ENDOPLASMIC RETICULUM UNFOLDED PROTEIN RESPONSE%GOBP%GO:1900101		26	0.40469408	1.0632583	0.41379312	0.6960403	1.0	2845	tags=42%, list=22%, signal=54%	
RRNA MODIFICATION IN THE NUCLEUS AND CYTOSOL%REACTOME%R-HSA-6790901.4	RRNA MODIFICATION IN THE NUCLEUS AND CYTOSOL%REACTOME%R-HSA-6790901.4		56	0.3312682	1.0631683	0.3478261	0.6959018	1.0	1857	tags=18%, list=14%, signal=21%	
HEXOSE METABOLIC PROCESS%GOBP%GO:0019318	HEXOSE METABOLIC PROCESS%GOBP%GO:0019318		75	0.31055194	1.0631446	0.30769232	0.6955758	1.0	2139	tags=21%, list=17%, signal=25%	
POSITIVE REGULATION OF CD4-POSITIVE, ALPHA-BETA T CELL DIFFERENTIATION%GOBP%GO:0043372	POSITIVE REGULATION OF CD4-POSITIVE, ALPHA-BETA T CELL DIFFERENTIATION%GOBP%GO:0043372		15	0.422278	1.0630292	0.33898306	0.6955053	1.0	5120	tags=67%, list=40%, signal=111%	
DNA DOUBLE-STRAND BREAK PROCESSING%GOBP%GO:0000729	DNA DOUBLE-STRAND BREAK PROCESSING%GOBP%GO:0000729		17	0.40860164	1.0628413	0.40625	0.6956628	1.0	2380	tags=35%, list=18%, signal=43%	
NEUROTROPHIN SIGNALING PATHWAY%GOBP%GO:0038179	NEUROTROPHIN SIGNALING PATHWAY%GOBP%GO:0038179		16	0.45371452	1.0626812	0.3968254	0.69577587	1.0	2976	tags=38%, list=23%, signal=49%	
DNA IR-DOUBLE STRAND BREAKS (DSBS) AND CELLULAR RESPONSE VIA ATM%WIKIPATHWAYS_20210210%WP3959%HOMO SAPIENS	DNA IR-DOUBLE STRAND BREAKS (DSBS) AND CELLULAR RESPONSE VIA ATM%WIKIPATHWAYS_20210210%WP3959%HOMO SAPIENS		40	0.35954687	1.0624937	0.3939394	0.6959052	1.0	3858	tags=43%, list=30%, signal=61%	
RIBONUCLEOSIDE TRIPHOSPHATE METABOLIC PROCESS%GOBP%GO:0009199	RIBONUCLEOSIDE TRIPHOSPHATE METABOLIC PROCESS%GOBP%GO:0009199		139	0.29308107	1.0624229	0.34117648	0.69574505	1.0	3299	tags=24%, list=26%, signal=33%	
RIBONUCLEOSIDE MONOPHOSPHATE METABOLIC PROCESS%GOBP%GO:0009161	RIBONUCLEOSIDE MONOPHOSPHATE METABOLIC PROCESS%GOBP%GO:0009161		142	0.28885734	1.0622253	0.36708862	0.6959991	1.0	2681	tags=20%, list=21%, signal=25%	
NEGATIVE REGULATION OF ION TRANSPORT%GOBP%GO:0043271	NEGATIVE REGULATION OF ION TRANSPORT%GOBP%GO:0043271		64	0.3233817	1.0620792	0.3116883	0.6960018	1.0	1296	tags=20%, list=10%, signal=22%	
POSITIVE REGULATION OF CYTOKINESIS%GOBP%GO:0032467	POSITIVE REGULATION OF CYTOKINESIS%GOBP%GO:0032467		20	0.39689103	1.0618094	0.41666666	0.6963858	1.0	2760	tags=40%, list=21%, signal=51%	
HALLMARK_UV_RESPONSE_UP%MSIGDB_C2%HALLMARK_UV_RESPONSE_UP	HALLMARK_UV_RESPONSE_UP%MSIGDB_C2%HALLMARK_UV_RESPONSE_UP		95	0.30466726	1.0613596	0.30379745	0.69730055	1.0	3048	tags=33%, list=24%, signal=42%	
TUMOR NECROSIS FACTOR-MEDIATED SIGNALING PATHWAY%GOBP%GO:0033209	TUMOR NECROSIS FACTOR-MEDIATED SIGNALING PATHWAY%GOBP%GO:0033209		86	0.31336913	1.0605588	0.278481	0.69929546	1.0	4116	tags=42%, list=32%, signal=61%	
PHOSPHATIDYLGLYCEROL BIOSYNTHESIS II (NON-PLASTIDIC)%HUMANCYC%PWY4FS-8	PHOSPHATIDYLGLYCEROL BIOSYNTHESIS II (NON-PLASTIDIC)%HUMANCYC%PWY4FS-8		17	0.43311957	1.0603434	0.44444445	0.6995123	1.0	931	tags=18%, list=7%, signal=19%	
MONOSACCHARIDE METABOLIC PROCESS%GOBP%GO:0005996	MONOSACCHARIDE METABOLIC PROCESS%GOBP%GO:0005996		95	0.3157707	1.0601157	0.39240506	0.6998187	1.0	2186	tags=23%, list=17%, signal=28%	
NUCLEOSIDE MONOPHOSPHATE METABOLIC PROCESS%GOBP%GO:0009123	NUCLEOSIDE MONOPHOSPHATE METABOLIC PROCESS%GOBP%GO:0009123		145	0.28414458	1.0600265	0.3375	0.69961727	1.0	2681	tags=19%, list=21%, signal=24%	
REGULATION OF G PROTEIN-COUPLED RECEPTOR SIGNALING PATHWAY%GOBP%GO:0008277	REGULATION OF G PROTEIN-COUPLED RECEPTOR SIGNALING PATHWAY%GOBP%GO:0008277		61	0.32394868	1.0598942	0.35897437	0.6995908	1.0	2798	tags=34%, list=22%, signal=44%	
NEGATIVE REGULATION OF CHROMATIN ORGANIZATION%GOBP%GO:1905268	NEGATIVE REGULATION OF CHROMATIN ORGANIZATION%GOBP%GO:1905268		36	0.33775884	1.0595036	0.38333333	0.70029217	1.0	2281	tags=25%, list=18%, signal=30%	
COPPER ION HOMEOSTASIS%GOBP%GO:0055070	COPPER ION HOMEOSTASIS%GOBP%GO:0055070		15	0.45616877	1.0594999	0.38709676	0.69990987	1.0	2903	tags=27%, list=23%, signal=34%	
PID_CD40_PATHWAY%MSIGDB_C2%PID_CD40_PATHWAY	PID_CD40_PATHWAY%MSIGDB_C2%PID_CD40_PATHWAY		22	0.40002152	1.0589987	0.37931034	0.70088995	1.0	1000	tags=14%, list=8%, signal=15%	
CELL-SUBSTRATE ADHERENS JUNCTION ASSEMBLY%GOBP%GO:0007045	CELL-SUBSTRATE ADHERENS JUNCTION ASSEMBLY%GOBP%GO:0007045		16	0.45009562	1.0586672	0.3508772	0.70134056	1.0	3089	tags=38%, list=24%, signal=49%	
LIPID HOMEOSTASIS%GOBP%GO:0055088	LIPID HOMEOSTASIS%GOBP%GO:0055088		77	0.30847844	1.058429	0.4084507	0.7016557	1.0	1518	tags=18%, list=12%, signal=20%	
REGULATION OF DENDRITE DEVELOPMENT%GOBP%GO:0050773	REGULATION OF DENDRITE DEVELOPMENT%GOBP%GO:0050773		69	0.3183004	1.0583054	0.32857144	0.70161146	1.0	2955	tags=29%, list=23%, signal=37%	
POSITIVE REGULATION OF EPIDERMIS DEVELOPMENT%GOBP%GO:0045684	POSITIVE REGULATION OF EPIDERMIS DEVELOPMENT%GOBP%GO:0045684		15	0.42120716	1.0582157	0.37878788	0.7014882	1.0	1633	tags=27%, list=13%, signal=31%	
NEGATIVE REGULATION OF CHROMOSOME ORGANIZATION%GOBP%GO:2001251	NEGATIVE REGULATION OF CHROMOSOME ORGANIZATION%GOBP%GO:2001251		88	0.3058238	1.0580512	0.3918919	0.7015954	1.0	3243	tags=30%, list=25%, signal=39%	
PEPTIDE LIGAND-BINDING RECEPTORS%REACTOME%R-HSA-375276.5	PEPTIDE LIGAND-BINDING RECEPTORS%REACTOME%R-HSA-375276.5		33	0.35819566	1.0580456	0.37179488	0.7012309	1.0	1251	tags=24%, list=10%, signal=27%	
REPLICATION FORK PROCESSING%GOBP%GO:0031297	REPLICATION FORK PROCESSING%GOBP%GO:0031297		28	0.3811488	1.0577933	0.3559322	0.70150083	1.0	4492	tags=43%, list=35%, signal=66%	
NEGATIVE REGULATION OF MAP KINASE ACTIVITY%GOBP%GO:0043407	NEGATIVE REGULATION OF MAP KINASE ACTIVITY%GOBP%GO:0043407		53	0.33695003	1.0577656	0.34666666	0.7011931	1.0	2107	tags=34%, list=16%, signal=40%	
PROTEIN LOCALIZATION TO MICROTUBULE ORGANIZING CENTER%GOBP%GO:1905508	PROTEIN LOCALIZATION TO MICROTUBULE ORGANIZING CENTER%GOBP%GO:1905508		19	0.4150835	1.0577638	0.36065573	0.7008014	1.0	2113	tags=26%, list=16%, signal=31%	
MODIFICATION OF MORPHOLOGY OR PHYSIOLOGY OF OTHER ORGANISM INVOLVED IN SYMBIOTIC INTERACTION%GOBP%GO:0051817	MODIFICATION OF MORPHOLOGY OR PHYSIOLOGY OF OTHER ORGANISM INVOLVED IN SYMBIOTIC INTERACTION%GOBP%GO:0051817		91	0.3161969	1.0576482	0.34210527	0.700758	1.0	2526	tags=30%, list=20%, signal=37%	
FGF SIGNALING PATHWAY%PATHWAY INTERACTION DATABASE NCI-NATURE CURATED DATA%FGF SIGNALING PATHWAY	FGF SIGNALING PATHWAY%PATHWAY INTERACTION DATABASE NCI-NATURE CURATED DATA%FGF SIGNALING PATHWAY		34	0.36392453	1.0575665	0.38271606	0.7006475	1.0	1466	tags=24%, list=11%, signal=26%	
POSITIVE REGULATION OF ALPHA-BETA T CELL DIFFERENTIATION%GOBP%GO:0046638	POSITIVE REGULATION OF ALPHA-BETA T CELL DIFFERENTIATION%GOBP%GO:0046638		22	0.381324	1.057198	0.3548387	0.70126975	1.0	2459	tags=32%, list=19%, signal=39%	
TRK RECEPTOR SIGNALING MEDIATED BY THE MAPK PATHWAY%PATHWAY INTERACTION DATABASE NCI-NATURE CURATED DATA%TRK RECEPTOR SIGNALING MEDIATED BY THE MAPK PATHWAY	TRK RECEPTOR SIGNALING MEDIATED BY THE MAPK PATHWAY%PATHWAY INTERACTION DATABASE NCI-NATURE CURATED DATA%TRK RECEPTOR SIGNALING MEDIATED BY THE MAPK PATHWAY		32	0.36030602	1.0567707	0.40983605	0.70214784	1.0	3100	tags=41%, list=24%, signal=53%	
FOXO-MEDIATED TRANSCRIPTION OF CELL CYCLE GENES%REACTOME%R-HSA-9617828.1	FOXO-MEDIATED TRANSCRIPTION OF CELL CYCLE GENES%REACTOME%R-HSA-9617828.1		15	0.45543474	1.0566844	0.33333334	0.7019855	1.0	1621	tags=33%, list=13%, signal=38%	
CALCIUM ION TRANSPORT INTO CYTOSOL%GOBP%GO:0060402	CALCIUM ION TRANSPORT INTO CYTOSOL%GOBP%GO:0060402		26	0.3641252	1.0566258	0.37662336	0.70175606	1.0	2839	tags=46%, list=22%, signal=59%	
BIOCARTA_ATRBRCA_PATHWAY%MSIGDB_C2%BIOCARTA_ATRBRCA_PATHWAY	BIOCARTA_ATRBRCA_PATHWAY%MSIGDB_C2%BIOCARTA_ATRBRCA_PATHWAY		19	0.3993546	1.0564377	0.42372882	0.7018962	1.0	881	tags=16%, list=7%, signal=17%	
CELL JUNCTION ASSEMBLY%GOBP%GO:0034329	CELL JUNCTION ASSEMBLY%GOBP%GO:0034329		114	0.29586214	1.0564024	0.35443038	0.7016284	1.0	2273	tags=22%, list=18%, signal=26%	
REGULATION OF CARDIAC MUSCLE HYPERTROPHY%GOBP%GO:0010611	REGULATION OF CARDIAC MUSCLE HYPERTROPHY%GOBP%GO:0010611		20	0.4193116	1.056378	0.37096775	0.70127183	1.0	2168	tags=35%, list=17%, signal=42%	
MEMBRANE ASSEMBLY%GOBP%GO:0071709	MEMBRANE ASSEMBLY%GOBP%GO:0071709		21	0.38731015	1.0563653	0.3809524	0.7009044	1.0	2955	tags=29%, list=23%, signal=37%	
N-GLYCAN TRIMMING IN THE ER AND CALNEXIN CALRETICULIN CYCLE%REACTOME%R-HSA-532668.2	N-GLYCAN TRIMMING IN THE ER AND CALNEXIN CALRETICULIN CYCLE%REACTOME%R-HSA-532668.2		33	0.35936192	1.0560863	0.33846155	0.701419	1.0	1700	tags=24%, list=13%, signal=28%	
REGULATION OF NEURON DEATH%GOBP%GO:1901214	REGULATION OF NEURON DEATH%GOBP%GO:1901214		126	0.3012621	1.0557562	0.34567901	0.7019154	1.0	3069	tags=32%, list=24%, signal=41%	
CELLULAR RESPONSE TO RADIATION%GOBP%GO:0071478	CELLULAR RESPONSE TO RADIATION%GOBP%GO:0071478		106	0.31039786	1.0554806	0.31506848	0.7023104	1.0	2373	tags=22%, list=18%, signal=26%	
COAGULATION%GOBP%GO:0050817	COAGULATION%GOBP%GO:0050817		158	0.2856461	1.0552932	0.29411766	0.7023831	1.0	1234	tags=16%, list=10%, signal=17%	
D-<I>MYO< I>-INOSITOL (1,4,5)-TRISPHOSPHATE BIOSYNTHESIS%HUMANCYC%PWY-6351	D-<I>MYO< I>-INOSITOL (1,4,5)-TRISPHOSPHATE BIOSYNTHESIS%HUMANCYC%PWY-6351		22	0.38708496	1.0550532	0.42857143	0.7026658	1.0	1695	tags=32%, list=13%, signal=37%	
PLK1 SIGNALING EVENTS%PATHWAY INTERACTION DATABASE NCI-NATURE CURATED DATA%PLK1 SIGNALING EVENTS	PLK1 SIGNALING EVENTS%PATHWAY INTERACTION DATABASE NCI-NATURE CURATED DATA%PLK1 SIGNALING EVENTS		38	0.35311964	1.05491	0.3809524	0.702694	1.0	1956	tags=26%, list=15%, signal=31%	
REGULATION OF LYMPHOCYTE APOPTOTIC PROCESS%GOBP%GO:0070228	REGULATION OF LYMPHOCYTE APOPTOTIC PROCESS%GOBP%GO:0070228		21	0.39335024	1.0547876	0.38235295	0.7026605	1.0	3704	tags=52%, list=29%, signal=73%	
CROSS-PRESENTATION OF SOLUBLE EXOGENOUS ANTIGENS (ENDOSOMES)%REACTOME DATABASE ID RELEASE 75%1236978	CROSS-PRESENTATION OF SOLUBLE EXOGENOUS ANTIGENS (ENDOSOMES)%REACTOME DATABASE ID RELEASE 75%1236978		42	0.35359982	1.0545473	0.4	0.7029931	1.0	3838	tags=40%, list=30%, signal=57%	
INTRA-GOLGI VESICLE-MEDIATED TRANSPORT%GOBP%GO:0006891	INTRA-GOLGI VESICLE-MEDIATED TRANSPORT%GOBP%GO:0006891		27	0.37089163	1.0544851	0.46153846	0.70276546	1.0	2807	tags=37%, list=22%, signal=47%	
MITOTIC SPINDLE CHECKPOINT%REACTOME%R-HSA-69618.2	MITOTIC SPINDLE CHECKPOINT%REACTOME%R-HSA-69618.2		89	0.2976845	1.0543139	0.38666666	0.7029538	1.0	3315	tags=33%, list=26%, signal=44%	
REGULATION OF TP53 EXPRESSION AND DEGRADATION%REACTOME%R-HSA-6806003.2	REGULATION OF TP53 EXPRESSION AND DEGRADATION%REACTOME%R-HSA-6806003.2		36	0.37045306	1.0541639	0.37931034	0.70303535	1.0	1269	tags=17%, list=10%, signal=18%	
REGULATION OF SYNAPSE STRUCTURE OR ACTIVITY%GOBP%GO:0050803	REGULATION OF SYNAPSE STRUCTURE OR ACTIVITY%GOBP%GO:0050803		77	0.314554	1.0537455	0.33333334	0.7037228	1.0	3378	tags=34%, list=26%, signal=46%	
REGULATION OF CELL SIZE%GOBP%GO:0008361	REGULATION OF CELL SIZE%GOBP%GO:0008361		80	0.30470884	1.0536964	0.33802816	0.7034572	1.0	2200	tags=24%, list=17%, signal=28%	
REGULATION OF REPRODUCTIVE PROCESS%GOBP%GO:2000241	REGULATION OF REPRODUCTIVE PROCESS%GOBP%GO:2000241		44	0.33844772	1.0536671	0.38666666	0.70313007	1.0	2514	tags=32%, list=20%, signal=39%	
REGULATION OF MUSCLE ADAPTATION%GOBP%GO:0043502	REGULATION OF MUSCLE ADAPTATION%GOBP%GO:0043502		24	0.40515608	1.0530074	0.3970588	0.7044959	1.0	1659	tags=33%, list=13%, signal=38%	
RESPONSE TO DECREASED OXYGEN LEVELS%GOBP%GO:0036293	RESPONSE TO DECREASED OXYGEN LEVELS%GOBP%GO:0036293		155	0.2795679	1.052975	0.35064936	0.7042353	1.0	2209	tags=22%, list=17%, signal=26%	
P53-INDEPENDENT DNA DAMAGE RESPONSE%REACTOME%R-HSA-69610.4	P53-INDEPENDENT DNA DAMAGE RESPONSE%REACTOME%R-HSA-69610.4		49	0.3519398	1.0528231	0.421875	0.7042021	1.0	3838	tags=39%, list=30%, signal=55%	
REACTIVE OXYGEN SPECIES BIOSYNTHETIC PROCESS%GOBP%GO:1903409	REACTIVE OXYGEN SPECIES BIOSYNTHETIC PROCESS%GOBP%GO:1903409		17	0.39653566	1.0523717	0.46268657	0.70497996	1.0	463	tags=18%, list=4%, signal=18%	
ESTABLISHMENT OR MAINTENANCE OF CELL POLARITY%GOBP%GO:0007163	ESTABLISHMENT OR MAINTENANCE OF CELL POLARITY%GOBP%GO:0007163		115	0.30367163	1.0523207	0.40243903	0.7046973	1.0	2106	tags=20%, list=16%, signal=24%	
COLLAGEN DEGRADATION%REACTOME DATABASE ID RELEASE 75%1442490	COLLAGEN DEGRADATION%REACTOME DATABASE ID RELEASE 75%1442490		17	0.42007744	1.0518361	0.39344263	0.7055054	1.0	2581	tags=29%, list=20%, signal=37%	
PURINE RIBONUCLEOSIDE MONOPHOSPHATE METABOLIC PROCESS%GOBP%GO:0009167	PURINE RIBONUCLEOSIDE MONOPHOSPHATE METABOLIC PROCESS%GOBP%GO:0009167		139	0.2893908	1.0513803	0.36708862	0.70638674	1.0	3299	tags=24%, list=26%, signal=32%	
C-MYB TRANSCRIPTION FACTOR NETWORK%PATHWAY INTERACTION DATABASE NCI-NATURE CURATED DATA%C-MYB TRANSCRIPTION FACTOR NETWORK	C-MYB TRANSCRIPTION FACTOR NETWORK%PATHWAY INTERACTION DATABASE NCI-NATURE CURATED DATA%C-MYB TRANSCRIPTION FACTOR NETWORK		64	0.30359	1.0513457	0.38554215	0.7061088	1.0	3769	tags=31%, list=29%, signal=44%	
PHOTODYNAMIC THERAPY-INDUCED NF-KB SURVIVAL SIGNALING%WIKIPATHWAYS_20210210%WP3617%HOMO SAPIENS	PHOTODYNAMIC THERAPY-INDUCED NF-KB SURVIVAL SIGNALING%WIKIPATHWAYS_20210210%WP3617%HOMO SAPIENS		16	0.4178318	1.0513407	0.3898305	0.70572144	1.0	3942	tags=44%, list=31%, signal=63%	
NEGATIVE REGULATION OF G PROTEIN-COUPLED RECEPTOR SIGNALING PATHWAY%GOBP%GO:0045744	NEGATIVE REGULATION OF G PROTEIN-COUPLED RECEPTOR SIGNALING PATHWAY%GOBP%GO:0045744		21	0.40431556	1.051213	0.42105263	0.7058247	1.0	2157	tags=38%, list=17%, signal=46%	
INTERLEUKIN-12 FAMILY SIGNALING%REACTOME%R-HSA-447115.5	INTERLEUKIN-12 FAMILY SIGNALING%REACTOME%R-HSA-447115.5		42	0.34338057	1.0511271	0.3529412	0.7056745	1.0	2400	tags=31%, list=19%, signal=38%	
DNA DOUBLE STRAND BREAK RESPONSE%REACTOME%R-HSA-5693606.2	DNA DOUBLE STRAND BREAK RESPONSE%REACTOME%R-HSA-5693606.2		40	0.3462588	1.0510353	0.40789473	0.70557934	1.0	2494	tags=25%, list=19%, signal=31%	
MUSCLE CONTRACTION%GOBP%GO:0006936	MUSCLE CONTRACTION%GOBP%GO:0006936		82	0.30643442	1.0510181	0.3943662	0.7052424	1.0	1892	tags=24%, list=15%, signal=28%	
POSITIVE REGULATION OF LIPID LOCALIZATION%GOBP%GO:1905954	POSITIVE REGULATION OF LIPID LOCALIZATION%GOBP%GO:1905954		49	0.33855018	1.0508997	0.46875	0.7051752	1.0	2107	tags=22%, list=16%, signal=27%	
RENIN ANGIOTENSIN ALDOSTERONE SYSTEM (RAAS)%WIKIPATHWAYS_20210210%WP4756%HOMO SAPIENS	RENIN ANGIOTENSIN ALDOSTERONE SYSTEM (RAAS)%WIKIPATHWAYS_20210210%WP4756%HOMO SAPIENS		16	0.41769272	1.0507478	0.4915254	0.7052457	1.0	1533	tags=31%, list=12%, signal=35%	
CONNECTIVE TISSUE DEVELOPMENT%GOBP%GO:0061448	CONNECTIVE TISSUE DEVELOPMENT%GOBP%GO:0061448		54	0.3360998	1.050565	0.37333333	0.7053254	1.0	1161	tags=19%, list=9%, signal=20%	
3Q29 COPY NUMBER VARIATION SYNDROME%WIKIPATHWAYS_20210210%WP4906%HOMO SAPIENS	3Q29 COPY NUMBER VARIATION SYNDROME%WIKIPATHWAYS_20210210%WP4906%HOMO SAPIENS		42	0.34395057	1.0505399	0.390625	0.7050389	1.0	1436	tags=17%, list=11%, signal=19%	
GENERATION OF SECOND MESSENGER MOLECULES%REACTOME DATABASE ID RELEASE 75%202433	GENERATION OF SECOND MESSENGER MOLECULES%REACTOME DATABASE ID RELEASE 75%202433		20	0.38393056	1.050323	0.37288135	0.70528376	1.0	2414	tags=25%, list=19%, signal=31%	
TP53 REGULATES TRANSCRIPTION OF GENES INVOLVED IN G2 CELL CYCLE ARREST%REACTOME%R-HSA-6804114.2	TP53 REGULATES TRANSCRIPTION OF GENES INVOLVED IN G2 CELL CYCLE ARREST%REACTOME%R-HSA-6804114.2		17	0.402953	1.050293	0.4032258	0.7049592	1.0	1621	tags=18%, list=13%, signal=20%	
DEPOSITION OF NEW CENPA-CONTAINING NUCLEOSOMES AT THE CENTROMERE%REACTOME DATABASE ID RELEASE 75%606279	DEPOSITION OF NEW CENPA-CONTAINING NUCLEOSOMES AT THE CENTROMERE%REACTOME DATABASE ID RELEASE 75%606279		19	0.40283915	1.0498402	0.4516129	0.70584446	1.0	2381	tags=21%, list=19%, signal=26%	
NEGATIVE REGULATION OF CELLULAR AMIDE METABOLIC PROCESS%GOBP%GO:0034249	NEGATIVE REGULATION OF CELLULAR AMIDE METABOLIC PROCESS%GOBP%GO:0034249		112	0.30178696	1.049387	0.425	0.7067068	1.0	3104	tags=27%, list=24%, signal=35%	
REGULATION OF T CELL ACTIVATION%GOBP%GO:0050863	REGULATION OF T CELL ACTIVATION%GOBP%GO:0050863		154	0.27763733	1.0493542	0.38271606	0.7064149	1.0	2638	tags=27%, list=21%, signal=33%	
PURINE NUCLEOSIDE MONOPHOSPHATE METABOLIC PROCESS%GOBP%GO:0009126	PURINE NUCLEOSIDE MONOPHOSPHATE METABOLIC PROCESS%GOBP%GO:0009126		139	0.2893908	1.0491958	0.36842105	0.7064184	1.0	3299	tags=24%, list=26%, signal=32%	
NEGATIVE REGULATION OF PROTEIN PROCESSING%GOBP%GO:0010955	NEGATIVE REGULATION OF PROTEIN PROCESSING%GOBP%GO:0010955		18	0.4164095	1.0491247	0.43137255	0.70625764	1.0	1018	tags=22%, list=8%, signal=24%	
REGULATION OF JNK CASCADE%GOBP%GO:0046328	REGULATION OF JNK CASCADE%GOBP%GO:0046328		112	0.3034749	1.0483263	0.4050633	0.70807797	1.0	2742	tags=26%, list=21%, signal=33%	
REGULATION OF CHOLESTEROL TRANSPORT%GOBP%GO:0032374	REGULATION OF CHOLESTEROL TRANSPORT%GOBP%GO:0032374		34	0.34913313	1.048291	0.41428572	0.7077967	1.0	1756	tags=26%, list=14%, signal=31%	
REGULATION OF CHEMOKINE PRODUCTION%GOBP%GO:0032642	REGULATION OF CHEMOKINE PRODUCTION%GOBP%GO:0032642		41	0.34707618	1.0482113	0.3846154	0.7076626	1.0	3668	tags=46%, list=29%, signal=65%	
AUTODEGRADATION OF THE E3 UBIQUITIN LIGASE COP1%REACTOME DATABASE ID RELEASE 75%349425	AUTODEGRADATION OF THE E3 UBIQUITIN LIGASE COP1%REACTOME DATABASE ID RELEASE 75%349425		48	0.3363215	1.0480283	0.41095892	0.7078622	1.0	3838	tags=38%, list=30%, signal=53%	
NEGATIVE REGULATION OF INSULIN RECEPTOR SIGNALING PATHWAY%GOBP%GO:0046627	NEGATIVE REGULATION OF INSULIN RECEPTOR SIGNALING PATHWAY%GOBP%GO:0046627		22	0.41598293	1.0476642	0.375	0.7083988	1.0	2107	tags=36%, list=16%, signal=43%	
POSITIVE REGULATION OF PROTEIN LOCALIZATION TO PLASMA MEMBRANE%GOBP%GO:1903078	POSITIVE REGULATION OF PROTEIN LOCALIZATION TO PLASMA MEMBRANE%GOBP%GO:1903078		39	0.33767217	1.0475084	0.28169015	0.708466	1.0	2352	tags=26%, list=18%, signal=31%	
REGULATION OF REACTIVE OXYGEN SPECIES METABOLIC PROCESS%GOBP%GO:2000377	REGULATION OF REACTIVE OXYGEN SPECIES METABOLIC PROCESS%GOBP%GO:2000377		99	0.29666683	1.0475067	0.4177215	0.7080928	1.0	3286	tags=38%, list=26%, signal=51%	
G1/S TRANSITION OF MITOTIC CELL CYCLE%GOBP%GO:0000082	G1/S TRANSITION OF MITOTIC CELL CYCLE%GOBP%GO:0000082		69	0.3063238	1.0467567	0.3243243	0.7097378	1.0	2313	tags=20%, list=18%, signal=25%	
HALLMARK_NOTCH_SIGNALING%MSIGDB_C2%HALLMARK_NOTCH_SIGNALING	HALLMARK_NOTCH_SIGNALING%MSIGDB_C2%HALLMARK_NOTCH_SIGNALING		19	0.44136813	1.046486	0.3898305	0.7100544	1.0	693	tags=16%, list=5%, signal=17%	
HIPPO-MERLIN SIGNALING DYSREGULATION%WIKIPATHWAYS_20210210%WP4541%HOMO SAPIENS	HIPPO-MERLIN SIGNALING DYSREGULATION%WIKIPATHWAYS_20210210%WP4541%HOMO SAPIENS		56	0.33734024	1.0463417	0.3529412	0.7099949	1.0	1921	tags=20%, list=15%, signal=23%	
FOXO FAMILY SIGNALING%PATHWAY INTERACTION DATABASE NCI-NATURE CURATED DATA%FOXO FAMILY SIGNALING	FOXO FAMILY SIGNALING%PATHWAY INTERACTION DATABASE NCI-NATURE CURATED DATA%FOXO FAMILY SIGNALING		45	0.34340307	1.0460805	0.35185185	0.7103391	1.0	1621	tags=16%, list=13%, signal=18%	
DENDRITE MORPHOGENESIS%GOBP%GO:0048813	DENDRITE MORPHOGENESIS%GOBP%GO:0048813		28	0.3766315	1.0457304	0.41935483	0.7110575	1.0	1944	tags=25%, list=15%, signal=29%	
ENDOTHELIAL CELL MIGRATION%GOBP%GO:0043542	ENDOTHELIAL CELL MIGRATION%GOBP%GO:0043542		36	0.35212484	1.0457258	0.33333334	0.71070045	1.0	1310	tags=22%, list=10%, signal=25%	
REGULATION OF PYRUVATE DEHYDROGENASE (PDH) COMPLEX%REACTOME DATABASE ID RELEASE 75%204174	REGULATION OF PYRUVATE DEHYDROGENASE (PDH) COMPLEX%REACTOME DATABASE ID RELEASE 75%204174		15	0.44128796	1.0456904	0.46551725	0.71038127	1.0	1367	tags=27%, list=11%, signal=30%	
REGULATION OF APOPTOSIS%REACTOME DATABASE ID RELEASE 75%169911	REGULATION OF APOPTOSIS%REACTOME DATABASE ID RELEASE 75%169911		50	0.3319278	1.0448228	0.35384616	0.7123751	1.0	3838	tags=36%, list=30%, signal=51%	
DOWNSTREAM SIGNALING EVENTS OF B CELL RECEPTOR (BCR)%REACTOME DATABASE ID RELEASE 75%1168372	DOWNSTREAM SIGNALING EVENTS OF B CELL RECEPTOR (BCR)%REACTOME DATABASE ID RELEASE 75%1168372		77	0.3077816	1.0446517	0.35714287	0.71245164	1.0	3838	tags=38%, list=30%, signal=53%	
QUINONE METABOLIC PROCESS%GOBP%GO:1901661	QUINONE METABOLIC PROCESS%GOBP%GO:1901661		26	0.3722257	1.044267	0.41269842	0.7131507	1.0	1655	tags=19%, list=13%, signal=22%	
VEGF SIGNALING PATHWAY%PANTHER PATHWAY%P00056	VEGF SIGNALING PATHWAY%PANTHER PATHWAY%P00056		54	0.32993367	1.0441664	0.46666667	0.7130963	1.0	2588	tags=30%, list=20%, signal=37%	
VESICLE-MEDIATED TRANSPORT BETWEEN ENDOSOMAL COMPARTMENTS%GOBP%GO:0098927	VESICLE-MEDIATED TRANSPORT BETWEEN ENDOSOMAL COMPARTMENTS%GOBP%GO:0098927		23	0.39618093	1.0438173	0.37096775	0.7136043	1.0	2497	tags=30%, list=19%, signal=38%	
